Name,Review,Rating,Price,Category,Protect_factor,Mask_func,Mask_img,Purchase_link,Mask_review
트라이탑 KF94 황사 마스크 50매 대형 개별포장 국산,21,5.0,17400,먼지차단마스크,KF94/N95,미세먼지필터@저자극@김서림방지@일회용@접이식,https://shop-phinf.pstatic.net/20210905_48/1630832619878oS9tg_JPEG/31968399601498544_1405618294.jpg?type=m510,https://smartstore.naver.com/altoshop/products/5473988223,관공서에서 받아서 써봤는데 정말 편하고 말하기도 쉽고 얼굴도 잘 가려줘서 구매하게 되었어요 새부리형도 써보고 덴탈마스크도 써보고 다 불편하고 만족하지 못했는데 앞으로는 이 마스크만 쓰게 될 것 같아요 타사 마스크도 좋았지만오랫동안 쓰고 있어도 귀도 편하고 숨쉬기가 좋아서 부모님도 사드리고 가격도 착해서 부담없이 사용하고 있습니다 박스에 이렇게 담아주실 줄 몰랐어요 감사합니다 재구매숨쉬기 편안하고 이제 여기로 정착해서 여러 개 샀습니다  재구매숨쉬기 편안하고 이제 여기로 정착해서 여러 개 샀습니다  한달사용기최고  매번 재구매해서 가족들 다 이걸로 쓰고있어요 어디서 하날 받아 써봤는데 너무 편해서 구매했습니다 감사의 마음을 전해주셔 즐거웠습니다 한달사용기BEST이 마스크를  우연히 10장받아서 사용하게됐는데94가 이렇게 편할수가있을까요피부에닿는 부분이 어디하나 까끌거림 ㅣ도없고 피부트러블조차도 없어요거기다 숨쉬기가 너무 편해서 100매사서 이것만 쓰고있어요   이거한번쓰면 다른 그어떤 94  못낍니다  우리집 온식구가 다 바꾸게됐어요  그냥보면 일반 kf94와 별반 다를거없이 생겼는데 껴보시면알아요 귀아픈것조차도없구  꼭사세요  이렇게좋은 마스크가 어찌 판매처가 한군데뿐일까싶기도하고 회사알아보니 근처라서 가서 쟁여오고싶은마음이었네요  주문하먼서 리뷰쓰고가요번창하세요 BEST재구매코로나이전부터 ㅣ년내내 마스크가 집에 없는적이없었던 집이에요 찬바람부는 가을부터 미먼 꽃가루때문에 마스크착용을 하던 가족이라서 안써본 마스크가없을정도로 많은 마스크를 써왔구요트러블 생길때도있었고 따가움 귀아픔 정말 많은 마스크를 써오면서 벗을수없었던이유는 온가족이 기관지가 너무 약해서 마스크를 껴야지만 그나마 감기나 기관지염이 덜걸려서요그러다 코로나터지고 관공서에 들어온 이 마스크를 우연히 10장받았었어요 여름에 kf94가 더운데다 불편해서 80으로 새부리모양 마스크만 착용하고 있었던터라 다 같겠지하고 10장전부 뜯지도않고 방치하다가 한번 써보고 신세계더군요이런 94마스크 첨봤어요첫째 94인데 새부리모양의 마스크 귀걸이가 칼국수모양이 아닌데도 전혀 아픔이없었어요귀아픔  눈밑 트러블숨쉬기정말 다 안아프고 안생기고 편함 끝판왕이에요여름철 덥지도않아요안써본사람은 있어도 한번만쓰는 사람은 없을거에요꼭사세요    안써본사람이 없기를요 한달사용기재구매늘 쓰는 제품입니다 KF94 인데 얇고 좋아서 여름에 쓰려고 구입합니다 강추 합니다 한달사용기좀 큰 마스크가 필요하다고 하셔서 엄마위해 주문해드렸어요 만족해하시네요 번창하세요 한달사용기이 마스크를 알고나서는 다른 마스크 안씁니다 너무 좋아요 재구매얼굴형을 싹 감싸주어 얼굴이 작아보이는 효과가 있습니다ㅋㅋ 사이즈도 좋아요 거기에 kf94라서 더 좋아요 얇아서 여름에 쓰기좋을거같고 통풍이 잘 돼서 덜 답답해요 한개 얻어서 써봤는데 너무 마음에 들어서 구매했어요 받아보니 낱개 포장이라서 더더 좋았어요 군에 있는  아들에게 보냈더니  귀가  아프지  않고  편하다고  하네요 사용해본거라 구매한건데 좀 얇아서 덜 답답합니다 배송도 빠르고 귀도 편해요 BEST배송 빠르고좋아요  숨쉬기좋고 보풀안생겨서 재구매각 ㅎ 크기가 넉넉해서 좋아요
블루본 마스크 소형 대형 새부리형 2D KF94 30매,138,4.9,16500,먼지차단마스크,KF94/N95,미세먼지필터@김서림방지@저자극@자외선차단@일회용@접이식,https://shop-phinf.pstatic.net/20211027_199/1635302254700o52CB_JPEG/36438100374609546_1402450091.jpg?type=m510,https://smartstore.naver.com/lowellstore/products/5412399024,재구매저는 이 마스크가 편하고 숨쉬기 좋고 좋아요사이즈도 딱 좋구다 써서 또 주문했네요 똥글똥글한 17kg 아들인데 늘 쓰던거이기도하구이제 제일 잘맞아서 구매했어요 감사합니다 ㅎㅎ 배송 빠르고 좋아요 항상 쓰는 마스크인데 가격도 저렴하고 좋아요 같이 보내주신 스트랩도 잘쓰겠습니다 감사합니다 재구매항상 쓰는거에요 애늘도  편하다고하고  다른건 아쓰네요  잘사용하고있습니다 항상 믿고 주문하는 블루마스크 배송빠르고좋네요ㅎㅎ 아에르보다 아주 조금 작아요 5세 얼굴쫌 큰 남아 아주 딱 맞아요 부리형이라 편해요 다른 사이트 보다 저렴하고 배송이 빨라서 좋았어요 한달사용기아이한테 잘 맞아서 계속 사용 중이에요 한달사용기아이들이 블루본만 써요 재구매비말차단이라 덜갑갑하고좋네여 아이도 편하게 쓸수있어요 코에 걸려서 밑에 내려가지않고 고정이잘 됩니다 빠른배송 숨쉬기 편해요 배송 문제로 조금 늦게 도착했지만 판매자분께서 빠른 해결해주셔서 감사합니다 최고해요 매번 이 마스크만 씁니다 아기 마스크중 최고 매번써요 너무 좋아요 아이 얼굴에 크지도 작지도 안고 잘  맞아 이것만 써요 재구매항상 잘쓰고있어요초등학생 유치원생 다좋네요 재구매저는 이 마스크가 편하고 숨쉬기 좋고 좋아요사이즈도 딱 좋구다 써서 또 주문했네요 똥글똥글한 17kg 아들인데 늘 쓰던거이기도하구이제 제일 잘맞아서 구매했어요 감사합니다 ㅎㅎ 배송 빠르고 좋아요 항상 쓰는 마스크인데 가격도 저렴하고 좋아요 같이 보내주신 스트랩도 잘쓰겠습니다 감사합니다 재구매항상 쓰는거에요 애늘도  편하다고하고  다른건 아쓰네요  잘사용하고있습니다 항상 믿고 주문하는 블루마스크 배송빠르고좋네요ㅎㅎ 아에르보다 아주 조금 작아요 5세 얼굴쫌 큰 남아 아주 딱 맞아요 부리형이라 편해요 다른 사이트 보다 저렴하고 배송이 빨라서 좋았어요 한달사용기아이한테 잘 맞아서 계속 사용 중이에요 한달사용기아이들은이것만사요 좋아요 잘쓰는마스크내요 ㅋ 매번 쓰는 마스크 아이가 이것만 찾아요 6살 아이가 이거만 착용해요 싸이즈 딱 좋아요 5세아이 소형 잘맞아요 추천받아서 구매해봤어요하나 뜯어서 잠깐 아이한테 착용시켜봤는데 편해보여요 배송도 빨라서 좋네요 6살 여자아이한테 사이즈가  딱맞아 이제품만 쓰고있어요부리형이 확실히 편안해하는것같아요 너무 좋아요 감사합니다 얼굴을 편안하게 감싸줘요여태  쓴것중 젤 잘 맞아요넘 얇지도 두껍지도 않고 숨쉬기도 편해요왜 이제사 만났는지잘 쓸께요 잘 받았습니다 스트랩까지 챙겨주시니 감동이네요 늘 쓰던거 너무 좋아요 한달사용기부리형이라 애기한테 잘맞아요 배송도 완전 빠르고 마스크도 너무 좋습니다 정기적으로 주문할 생각이 듭니다 한달사용기마스크는 좋은데 딸 아이가 한개 써보고 좋다고 해서 50개나 샀는데 이번에는 크다고 불편하다네요엄마인 제가 하기엔 작아서 불편하고딸아이가 클때까지 쟁여놓을 수도 없고마스크가 나쁜건 아닌데 아까운 마음이네요참고로 초4학년 평범한 얼굴 크기입니다ㅠ 배송 잘 되었습니다 잘 쓰고 있습니다 한달사용기좋습니다 아이도편해합니다 한달사용기한달리뷰인데 벌써 다 써가네요곧 다시 주문해야할듯요ㅠ아이들이 초47세5세인데11세 여아에겐 조금 조인다는데 그냥 사용할만하다구요두 유아들얼굴이 조금 큰편ㅋ은 편하게 사용하네요참고하세요 너무 편하고 좋아요 얼굴을  촥  감싸줘서  너무 좋아요 엄마 선물 드렸어요 새부리형 편하시대요  괜찮아요 낱개포장 빠른뱃ㅇ 블루본 마스크 좋아요 다음엔 2D로 주문할께요 맘에들어요다음에또구매할께요 초1 얼굴작은 아이 다른 소형은 다 큰데 이건 딱 맞아요 배송도 빠르네요 한달사용기뽀로로만 쓰던 우리아이가 절대로 안쓸것 같던 이제품을 어렵게 한번 써보더니 뽀로로는쳐다도 안보고 요 블루본 마스크만 찾아요 사이즈 넉넉하고 보풀도 안일어나고 끈도 탄럭이 좋아 귀를 조인적이 한번도 없어요 끈이 떨어진적도 없네요 블루본마스크가 정말 좋은 제품이네요 아이가 이 마스크가 제일 편해하는 것 같아 구매했습니다 아이꺼 자주 구매해서 이번엔 어른것도 구매해봤어요 아이가 이 마스크가 제일 편해하는 것 같아 구매했습니다 아이꺼 자주 구매해서 이번엔 어른것도 구매해봤어요 배송 빨라요 가격도 제일 저렴하구요 잘 쓸게요 5세여아 블루본 마스크 제일 잘 써요 얼굴을 편안하게 감싸줘요여태  쓴것중 젤 잘 맞아요넘 얇지도 두껍지도 않고 숨쉬기도 편해요왜 이제사 만났는지잘 쓸께요 잘 받았습니다 스트랩까지 챙겨주시니 감동이네요 늘 쓰던거 너무 좋아요 한달사용기부리형이라 애기한테 잘맞아요 배송도 완전 빠르고 마스크도 너무 좋습니다 정기적으로 주문할 생각이 듭니다 한달사용기마스크는 좋은데 딸 아이가 한개 써보고 좋다고 해서 50개나 샀는데 이번에는 크다고 불편하다네요엄마인 제가 하기엔 작아서 불편하고딸아이가 클때까지 쟁여놓을 수도 없고마스크가 나쁜건 아닌데 아까운 마음이네요참고로 초4학년 평범한 얼굴 크기입니다ㅠ 배송 잘 되었습니다 잘 쓰고 있습니다 한달사용기좋습니다 아이도편해합니다 한달사용기한달리뷰인데 벌써 다 써가네요곧 다시 주문해야할듯요ㅠ아이들이 초47세5세인데11세 여아에겐 조금 조인다는데 그냥 사용할만하다구요두 유아들얼굴이 조금 큰편ㅋ은 편하게 사용하네요참고하세요 너무 편하고 좋아요 얼굴을  촥  감싸줘서  너무 좋아요 엄마 선물 드렸어요 새부리형 편하시대요  6세 쓰기 괜찮아요 6세쓰기 좋습니다 숨쉬기편하고칼큼해서좋아요 블루마스크로 확정입니다 너무 좋아요 한달사용기코로나 초기 어린이집에서 나눠준 마스크로 처음 접했는데그동안 이것 저것써보면서 이게 제일 저희 아이 얼굴에 잘맞고 좋다는걸 알게 되었씁니다그래서 제것도 같이 구매했는데 확실히 쓰기 좋아요앞으로 마스크는 이걸로 정착하려구요 감사합니다 숨쉬기편하고 새부리형중에서 제일 좋아오 어른이  쓰기에도  굿  좋은  상품입니다배송은  굿이예요 빠른배송감사합니다 덤으로주신 목걸이도잘쓸게요 사이즈 딱이에요 재구매요 사이즈도 넘좋고 편해요 저희아들은 요것만 쓰고 요것만 좋아하고요것만 냄새가 불쾌하지 않다네요;; 한달사용기2단형태를 아이가 편하는데 먼지어흥 새로운 스타일이라 구매해봤는데 마스크돈면주에 귀엽운 문양도 있어서 아이가 좋아해요 5세 아이에게 잘 맞네요 만족합니다 재구매의사 굿 좋은 가격에 좋은 제품을 만났네요 아이가 편하대요 좋대요 아기한테 잘 맞아서 사용하고있습니다좋아요 아이가 좋아하네요 아이기 좋아합니다 아이들쓰기너무편해요 우리 작은 아이에게는 이만한게 없네요 ㅎ 딸냄이 안경쓰고 볼이 통통해서 블루본 대형이 딱 좋다고 하네요  숨 쉬기도 편하고 안경에김도 안서리고 얼굴도 작아 보이는 매직 마스크에요 ㅎㅎ 잘못사서 교환했는데도 엄청빨리 변경해 출고해주셔서 감사합니다 BEST착용편하고 우선 아이가 찾는 마스크 ㅋㅋㅋ KF94인데도 숨쉬기 편해해요  아들이 등원할때 마다 초록색 마스크비닐겉면이초록색 초록색 ㅋㅋ 하며 kf94만 찾아요  잘쓰고 다니는 아들이 대견스러우며서 블루본에 감사해요  편하게 만들어주셔어 감사합니다 우리아이가 좋아하는 마스크에요 이제품 사용해보고는 다른 제품은 거부해요 빠른배송 감사합니다 안그래도 똑 떨어져서 꼭 필요했거든요 6세아이에게 딱 맞는 사이즈에요 한달사용기애들이 불편없이 잘 사용해서 좋네요 아이가 좋아하고 포장도 잘 되고 선물과 소개자료도 감사해요 한달사용기잘쓰고있어요 감사합니다 우리 아이가 젤로 좋아하는 마스크에요 이 제품 쓰고는 다른 제품은 착용하지 않네요 6세 아이에게 딱 맞아요 빠른 배송 너무 감사합니다 배송도 빠르고 상품도 좋습니다 이뻐요맘에들어요감사합니다 어제 주문했는데 오늘 도착 배송 빠르네요스트랩까지 주시고 ㅎㅎ 또 이용할게요 사이즈도 딱 맞고 착용도 편해요 배송 빠르고 신제품을 저렴한 가격에 잘샀어요블루기본 새부리형 마스크는 잘 안쓰더니이건 호랑이모양이라고 새부리형이라도 아주 잘써요ㅎ 만족합니다 재구매의사 굿 좋은 가격에 좋은 제품을 만났네요 아이가 편하대요 좋대요 아기한테 잘 맞아서 사용하고있습니다좋아요 아이가 좋아하네요 아이기 좋아합니다 아이들쓰기너무편해요
박보영 닥터스마일케이 KF80 KF94 마스크 소형 중형 대형 새부리형,97,4.8,550,먼지차단마스크,KF94/N95,미세먼지필터@일회용@접이식,https://shop-phinf.pstatic.net/20211011_258/1633930968873c98L1_JPEG/35066814356760327_525743875.jpg?type=m510,https://smartstore.naver.com/jhakzpt/products/5192363716,너무  편해요  마스크 편한거 찾으려고  진짜 많이  주문했어요  몇개씩  이 마스크가  제일 숨쉬기 편해요  앞으로  이걸로  쭉 아에르소형과 중형사이즈 중간을 쓰고 싶어서 주문했는데 딱 맞네요 재구매여기가 그나마 제일 저렴한듯해요아이가 셋이라 추워지기도해서 94로 블랙조아해서 주문했어요 울아들은 이마스크만 좋다 하네요 재구매이것만 쓰는 아이 제가 다쓸때 주문해서 배송오는동안 급한대로 다른거 써보라고 했는데 블루마스크 아니면 안된다고 난리를치고 학교에 갔네요ㅜㅠ담엔 20장 남을때 미리 주문해달라고 부탁하더라구요 한달사용기좋아요 울아들 최애 마스크이네요 재구매항상 재구매 하고있는 재품이라 믿고구매해요 한번착용해보고 얼굴에도 딱맞고다른대형사이즈보다는 살짝작은지 좋네요 조금 작은 얼굴에 맞는 마스크입니다 계속 주문해서  사용중입니다고맙습니다  대형이여도 사이즈 적당하고 딱좋아요 리뷰보고 주문했는데 넘 만족합니다7세 아들은 좀 크긴한데 여지것 사용했던 마스크중 최고새부리형은 딸램이한테 딱맞네요대형도 넘넘 예쁘게 딱맞아요남자들이 사용하긴 좀 작을거같은데여자인 제가 사용하기는 넘 좋아요 아이가 이것만 편해해서 구입합니다 늘 이것만 써요 착용감 좋아요 이 제품만 써요 편합니다 사이즈가 아주살짝 타이트한 편 같아요 아이들 여름 다가와서 주문했는데 처음 사용해봅니다 저렴하게 잘 구매했습니다 잘 쓸게요 재구매애들이 여기 마스크 아니면 안쓰려 해요 편한가봐요 애들이 엄청 편해합니다나중에 어른 마스크 다쓰면 블루본으로 주문해야겠어요 한달사용기사실 처음엔 kf80 새부리형으로 보고 샀어요 ㅠㅠ 제가 유심히 안읽었는지 그렇게 보였어요 품질은 좋습니다 화장도 안묻고 귀도 안아프고 냄새도 안나여 너무  편해요  마스크 편한거 찾으려고  진짜 많이  주문했어요  몇개씩  이 마스크가  제일 숨쉬기 편해요  앞으로  이걸로  쭉 아에르소형과 중형사이즈 중간을 쓰고 싶어서 주문했는데 딱 맞네요 재구매여기가 그나마 제일 저렴한듯해요아이가 셋이라 추워지기도해서 94로 블랙조아해서 주문했어요 울아들은 이마스크만 좋다 하네요 재구매이것만 쓰는 아이 제가 다쓸때 주문해서 배송오는동안 급한대로 다른거 써보라고 했는데 블루마스크 아니면 안된다고 난리를치고 학교에 갔네요ㅜㅠ담엔 20장 남을때 미리 주문해달라고 부탁하더라구요 한달사용기좋아요 울아들 최애 마스크이네요 8세 장두형 얼굴 작은 남아예요작은게나온 소형이 필요했는데 새부리형에 얼굴 감싸는 사이즈 딱 좋았어요 몇개 더 씌워봐야알겠지만 보관하기에 부피가 크기도 않고 개별포장이라 마음에 드네요 배송이 빠르고 숨쉬기도 편합니다 한달사용기8살아이 사이즈 딱 좋아요 배송도 빠르고 아이가 편안하다고 하네요 배송도 빠르고 아이가 편안하다고 하네요 숫자도 잘 세어볼수있게 센스껏 넣어주셨네요 잘받았습니다 잘받았습니다 중공역병이 사라지는 그날을 기원하며 잘받았습니다 맘이든든하네요 한달사용기아이도 편해한 마스크예여 가격대비 좋고여 한달사용기편한 마스크예여 배송도 빠르게 잘왔고요 재구매원래쓰던제품저렴하게구매했어요 재구매원래쓰던제품저렴히구매했어요 어머니가 이것만 찾네요 근데이건 왜비싼거임 한달사용기아주 좋아서 계속 구입하네요 한달사용기앞으로 계속 구매하겠습니다 할머니 할아버지께서 가장 편하게 착용하시는 마스크에요 재구매합니다 한달사용기재구매아주 마음에 들어요 부리형이 편한데 사이즈가 다 달라서 여러가지 구입해봤는데 이건 사이즈가 적당하네요얼굴크기 보통이고 볼살없어요;  귀끈은 넉넉해요 부리형이 편한데 사이즈가 다 달라서 여러가지 구입해봤는데 이건 사이즈가 적당하네요얼굴크기 보통이고 볼살없어요;  귀끈은 넉넉해요 사이즈 적당하고 아이들이 편하게 쓰기 좋아요  라지사이즈도 초등 6학년에게 딱 맞아요 8세 장두형 얼굴 작은 남아예요작은게나온 소형이 필요했는데 새부리형에 얼굴 감싸는 사이즈 딱 좋았어요 몇개 더 씌워봐야알겠지만 보관하기에 부피가 크기도 않고 개별포장이라 마음에 드네요 배송이 빠르고 숨쉬기도 편합니다 한달사용기8살아이 사이즈 딱 좋아요 배송도 빠르고 아이가 편안하다고 하네요 배송도 빠르고 아이가 편안하다고 하네요 숫자도 잘 세어볼수있게 센스껏 넣어주셨네요 잘받았습니다 잘받았습니다 중공역병이 사라지는 그날을 기원하며 7살 여아한테 찰떡입니다 크기도 숨쉬기도 좋아요 크기도 숨쉬기도 좋아요 배송이 매우 빠릅니다 상품이상없이 잘 왔고 늘 쓰던 제품이라 만족합니다 이상하게 아이가 이 제품만 편하게 생각하더라구요재구매할거에요 주문한날 배송되어 바로 다음날 받았어요가격도 만족하고 칼배송도 대만족이에요ㅎㅎㅎ저희아이 블루본만 사용하는데 다쓰고나면 재구매할께요 조금 비싸긴 한데 품질은 좋아요 아이가 선호하는 제품이구요 초3 마른아이인데 소형이 약간 작아보이는데 그렇다고 대형 쓰기엔 너무 떠서 다른 제품 찾아 봐야 할듯요ㅠ 저렴하게 구입해서 좋아요 딸이편하다고해 이제품만이용합니다 좋아여  아이가 잘써요  초등 고학년 아이가 쓰는데 확실히 편하고 좋다 하네요 계속 사야 할것 같아요 ㅎ 아이가좋아하는마스크가 가격이내려 좋아요 5살 딸아이한테 사이즈 잘 맞아서 좋아요 편하다고 하네요 아이가 잘쓰고있어요 저렴하게 샀어요 포장도 잘되어 았네요 5살 딸아이한테 사이즈 잘맞아서 좋아요 저렴하게 샀어요 포장도 잘되어 왔어요 사이즈딱좋습니다 잘쓰겠습니다
퓨리타스 숨라이트 마스크 KF94 숨편한 겨울용 귀편한안아픈 대형 국내산 숨 라이트마스크,4,4.8,430,먼지차단마스크,KF94/N95,미세먼지필터@저자극@방한@자외선차단@방수@김서림방지@일회용@접이식,https://shop-phinf.pstatic.net/20211027_176/1635271474647aRF37_JPEG/36407373350381771_356706043.jpg?type=m510,https://smartstore.naver.com/ssa_sa/products/5961014999,100개 주문했어요 마트보다 한장에 백원이나 저렴해서ㅜㅜ 이 마스크 써보고 숨쉬기도 편하고 조이지도 않아서 인터넷으로 주문하게 됐어요 완전 짱이에요 스트랩이랑 사탕 선물 ad도 주셔서 감사합니다 잘 쓸게요 대박나세용 3번째 구매 퓨리타스 KF94 귀가 아프지 않아서 좋아요 오래 착용해도 보포라기가  일어나지 않아 좋아요  잘 쓰겠습니다 얼굴큰 우리 남편의 최애 마스크입니다 숨쉬기가  편해요
더케이 지원정 KF94마스크 대형 3D입체형 100매 벌크형 귀안아픈 숨쉬기편한마스크,10,4.7,18900,먼지차단마스크,KF94/N95,김서림방지@미세먼지필터@일회용@접이식,https://shop-phinf.pstatic.net/20211018_168/1634539653726OxCL6_PNG/35675552168135834_511323051.png?type=m510,https://smartstore.naver.com/maskshoping/products/5938268197,얼굴이 잗아서 저한텐 엄청커요ㅠㅠ남편한테도 살짝 크지만 남편꺼 됬네요200개나 샀는데ㅋㅋㅋ  200일 끄떡없네요근데 검수가 어려운점이 있어요 한번에사서끈 제대로 되있는지는 해봐야 알거같네요 괜찮겠죠 항상 쓰던거라 재구매하는 마스크에요 이만큼 편한 마스크가 없네요 가격이 살짝 올라 아쉽지만 그래도 착한 가격입니다 포장이 더 깔끔하게 바뀌었네요 배송도 빠르고 좋아요 너무 잘샀어요 편하고 좋아요 저렴한가격에 잘 구매했습니다 싸게 잘 구매했어용 감사합니다 가격대비 괜찮아요 신랑도 만족하는 마스크에요 항상구매하는제품입니다 생각했던것보다 훌륭함
