Name,Review,Rating,Price,Category,Protect_factor,Mask_func,Mask_img,Purchase_link,Mask_review
아동 KF94 마스크 소형 25매 유아 마스크 아장아장,21,4.5,10800,먼지차단마스크,KF94/N95,미세먼지필터@김서림방지@저자극@일회용@접이식,https://shop-phinf.pstatic.net/20210525_151/1621954107578sJ48a_JPEG/23090006243453518_1143612231.jpg?type=m510,https://smartstore.naver.com/fatherchoice/products/4954590946,BEST이 마스크 정말 정교하게 잘 만든 것 같아요 아이들 마스크 구매 여기저기 많이 비교 해봤는데 얼굴을 잘 감싸주구 아이가 많이 편해하네요정말 좋아요 한달사용기꾸준히 썼는데 아직도 많이 남아있네요 국산이라서 믿고 쭉 잘 쓰고있어요 재구매가볍고 얇아서 더워도 편합니다 BEST요즘같은 시기에 진짜 빠른 배송에 깜짝 놀랐네요이제품 전에 다른곳에서 구매한후 너무 좋아서재구매하려고 검색하다가  단골로 등록해놓았던 곳에서 판매하시는걸 발견하고 바로 구매했네요 더워진 날씨에 이만한게 없어요 너무 얇기만 한건 보호가 안되는 느낌인데 이건 두께도 적당하고 원단이 부드러운데 코팅이 살짝 되어있는 느낌으로 피부에도 자극이 전혀없어서 너무 좋았구여 장시간 마스크 착용하고 있음 귀가 너무 아픈데 이건 신기하게 그런게 하나도 없어요그리고 크기도 넉넉해서 저의 큰 얼굴을 잘 감싸줍니다 ;;; 덕분에 좋은마스크 최저가로 잘 구매했네요 포장이단단하지못해 박스가 찌그러지고 메이드인코리아 라는 말도 찾아볼수없고이전에 다른곳에서 산 같은제품과 느낌이 다르네요비닐포장상태도 위생적이지 않은듯암튼 저는 좀 실망 별 하나도 아깝다마스크 코 지지대 엉망입니다얇은 철사 하나 안 들어 있는 제품으로 감염원을 보호 한다니 참 어이없는 제품 다른 제품 알아 보세요 한달사용기100매라서 소분해서 포장해서 써요편하게 하루에 하나씩쓰는중이랍니다 리뷰보고 마음이 불안불안했어요그리고 다른스토어 리뷰를 정독ㅠㅠ쿠팡리뷰도 계속보고 그랬죠결론은 저는 너무좋아요가볍고 숨쉬기편하고 냄새안나고줄도 짱짱합니다 저는휴xxx제품 중국산3월에 샀었는데턱밑으로 두드러기가ㅠㅠ그래서 신중하게 구매한거거든요친정집에도 100매보내드렸는데하자마자 줄이 뚝끊어져버렸다고ㅠ제품이 복불복인지왜그럴까여주인장님 매입하실때꼼꼼히따지셔야할것같아요 냄새도 안 나고 국산이라 믿고쓰네요 배송도 빨랐고 요새 날씨가 너무 더워서 덴탈마스크 많이 사용해서 금방금방 쓰니까 아예 100매 짜리로 구매했습ㄴ다 저렴하게 잘 샀어요 BEST배송도 빠르고 국산이라 그런지 다른 저가 덴탈마스크와는 확실히 퀄리티가 다르네요 여름에 써도 답답하지 않게 쓸수 있을것 같고 장시간 착용해도 귀가 편안하고 부드러워서 좋아요 배송 상품 모두 만족합니다 저렴하게 잘 구매한것 같아요감사합니다 마스크얇고우리나라에서만든거라니까안심되요 BEST맘카페에서 제일 유명한 덴탈마스크라 구매했어요 워낙 좋은 제품이여서 가족 모두 사용중입니다빨리 받을 수 있고제일 착한 가격에 구매해서 너무 좋네요오 감사합니다 BEST배송빠르고 국산이라서 더 마음에 드네요 좋아요 조금 더 두꺼웠음 좋겠던데생각보다는 얇네요여름이라 더워서 얇게 나왔나봐요오염은 전혀없었고 끈 불량도 없었어요갯수를 2번 세었는데 99개네요ㅠ BEST대량이라 일단 너무 좋구요 가격도 나름 합리적이고 재질도 부드러워서 얼굴이 안가려워서 좋아요 박스에는 국산이라는 표시가 없네요 시원해서 좋아요불량이 없어요 ㅎㅎ BEST문의에도 친절히 응대해주시고 감사합니다사업 번창하세요
블루인더스 블루본마스크 KF80 소형 50매(1Box),145,4.9,27500,먼지차단마스크,KF80,미세먼지필터@김서림방지@일회용@접이식,https://shop-phinf.pstatic.net/20201211_208/16076884889822dWMb_JPEG/8824384552444685_2078591696.jpg?type=m510,https://smartstore.naver.com/itemkingdom/products/5025485756,재구매애들 이 마스크만 씌워요 저렴한 가격에 잘 샀어요 항상 주문해서 쓰는 제품이에요 아주맘에들어요아주맘에들어요 재구매잘받았습니다 감사합니다 한달사용기재구매저희집 애는 블루본 마스크만 찾아요 한달사용기5살 아이 끈 조절 필요없이 잘 사용하고 있습니다 한달사용기아이들이 숨쉬기 편하다고 좋아해요 아이가 이것만 씁니다ㅎㅎ 한달사용기6살아이 1년째 꾸준히 이제품만 사용중입니다완전 만족하며 쓰고있어요여름이 다가오니 비말마스크도 나왔음 하는 바람입니다 4살 아이에게 조금 크네요 새부리형이라 숨쉬긴 편항 것 같아요 재구매아이껀 계속 이걸로 주문하게되네용 언제나 잘사용하고있는 제품이예요ㅎㅎ 감사합니다 배송 빠르고 좋아요 한달사용기재구매아이들이  이 마스크만  쓰려해서  정기적으로  구매합니다 한달사용기아이사이즈에 잘맞고 사용감 편안해 보여요 94쓰다 더울까봐 80 으로 주문했어요 항상쓰늣거에요 재구매빠른배송 편리한착용 아기가 다른건 정말 않쓰는데 이건 두시간이상 쓰네요 재구매사이즈가 딱이에요 재구매애들 이 마스크만 씌워요 저렴한 가격에 잘 샀어요 항상 주문해서 쓰는 제품이에요 아주맘에들어요아주맘에들어요 재구매잘받았습니다 감사합니다 한달사용기좋아요 잘벗겨지지 않고 짱짱해요 한달사용기5세 얼굴 작은편이고 여태껏 써왔던 마스크중 사이즈 제일 잘맞네요 재구매 의사있어요 초2와6세가 함께 사용 가능하네요편하다고 좋다고해요 ㅎㅎ유통기한도 넉넉하고 포장도 잘 왔어요 ㅎㅎ 아이가 편해해서 늘 사용하는 마스크입니다부리형이라 좋아요 배송도 빠르고 좋아요아이가 요것만 쓸려고하네요다쓰면 재구매할께요 숨쉬기 편한 부리 모양이라 애기가 잘 착용해요또 구입할듯 해요 늘 쓰던거라 재주문 재구매아이들이  불편하단  소리없이  좋아합니다 한달사용기계속 구매해서 사용하는 마스크예요 아이에게 잘 맞고 좋네요 아이들이 블루본 마스크만 쓰는데 좀 저렴히 구매할 수 있었어요 배송도 빨라요 재구매좋아요 배송도 빠르고 아이에게 너무 잘맞아서 좋네요 안경을 써서 이 마스크가 제일이네요 아이가 요것만 쓰려고 하네요 리뉴얼되기 전 빨강색 포장지가 사이즈가 좀더 작아서 따맞긴 했지만 요것도 만족이요 재구매아이들에게 딱이예요 만8세 여아 만11세 여아이가 쓰기에 좋아여 크지도 작지도 않고적당해서 이 제품으로 계속쓰고 있어요 다른 마스크들도 많이 사서 써봤는데 아이들에게 씌우기 가장 편하고 아이들도 거부감 없이 잘 쓰고 다닙니다 올해 9살 6살 되는 아이들 모두 씁니다 애들이 쓰기편하다고 합니다 아이들에게사이즈도 잘맞고 숨쉬기편하다네요 한달사용기아이가 마스크 이것만 한다고 고집해요 편하다 그러고 4살때부터 스스로 잘하더라구요 3단으로 접히는것 보다 요렇게 생긴게 어린아이들이 잘해요 5세 7세 두아이 매일 씁니다 좋아요 4살아이에게 딱맞아서 계속구매중이에요 써본마스크중에 젤 크기도맞고 좋아요 새부리형 중에서도 앞으로 많이 나와있는 편이라 숨쉬기도 좋고 5세8세 아이까지 잘 맞아요 숨쉬기편해요아들이 요것만쓰네요 소형마스크 여러개 사보았는데 이 제품이 아이가 제일 편하다고 하네요 한달사용기항상 주문해요 좋아요 마스크 깔끔하고 좋네요 아이얼굴에 제일 잘맞아여 4살어린이에게 끈묵지않고 쓸수잇어오부리형이라 위에는살짝뜹니다 한달사용기6살 아들이 이 마스크만 쓰네요다른 마스크가 무용지물이 되버렸어요숨쉬기가 편하다고 이것만써요재구매하러왔다가 후기남겨요 포장꼼꼼하고 배송빨라요 항상사용하는 제품입니다 마스크가격이 좀 떨어져서 다행입니다 4세아들 조금 크지만 괜찮아요 한달사용기잘쓰겠습니다 감사합니다 재구매앞이ㅜ뽀족해서 이것만 싸요 가볍고  튼튼해시  좋습니다 3살아이 이것만 편해 하네요 배송 감사합니다 잘맞아용 숨싀기좋어요 항상 애용하는 이만한게 없네요 한달사용기좋아요좋아요좋아요좋아요 맛좋은 꿀토마토입니다 얼굴작은 6세여아 딱 맞춤이에요 4살아이 통통한 얼굴인데 살짝 여유있고 괜찮아요 6살 남아 코로나 이후 이것만 써요3단은 입에 닿아서 불편하다네요새부리형이 편한가봐요오늘도 착용하고 유치원 갔어요 늘주문합니다애기한테딱 한달사용기잘사용하고있어요아이한테 딱이에요 아이가 편하게써서 더 구매했습니다 항상 애용해요 너무 좋아요 4살어린이에게 끈묵지않고 쓸수잇어오부리형이라 위에는살짝뜹니다 한달사용기6살 아들이 이 마스크만 쓰네요다른 마스크가 무용지물이 되버렸어요숨쉬기가 편하다고 이것만써요재구매하러왔다가 후기남겨요 가격좋아서 샀는데 배송도 빨라요 새부리형이라 애들이 편안해해요 아이가 좋아해서 재구매했어요수량정확하고 유통기한도 넉넉합니다 물건 싸게 구매 잘했네요 ㅎ박스도 찌그러짐 없이 포장도 잘되서 왔구요사용기한도 넉넉하니 좋아요 다쓰고 나면 또 구매 할께요 31개월 4살 아들한테 살짝 커서 끈 양쪽 조금씩 묶어주고 쓰니 잘맞아요배송도 빠르고 질도 좋네요 한달사용기아이에게 잘맞아 좋아요 한달사용기5세남자아이편하게 잘 사용 하고 있네요 사용해 보고 재구매했어요 아이가 이것만 사용하려고 해요 7살 아이의 얼굴에 딱 맞아 좋아요 코 부분이 튀어나와 있어 숨쉬기 편하구요 6세여아에게 딱맞노조아용 사이즈가 딱 좋아요 배송도 빠르고 갯수도 정확하게 왔습니다 한달사용기아이들이 착용 할때 새부리형태라서 편안해 해요 6세 아이한테 잘맞네요새부리형이라 아이가 편해해요배송도 빠르고 좋습니다 5살 남아좋아요아이들 마스크 가격 너무 비싼데그나마 착한가격이네요 50장 맞게 잘왔고 하나에1750원에 사서쓰다가 가격이 점점 내려가서 쟁였어요 좋은가격에 잘 샀습니다 9세 여자아이입니다편하게 잘 맞아요배송도 하루만에 왔어요 ㅋㅋ잘 쓰겠습니다 가격이 많이올랐네요 그나마 조금더 저렴하게 잘샀어요 부리형이라 좋으네요 배송 총알이에요담날 바로 받았습니다갯수도 정확해요 아이가 부리형마스크를 편안해하여ㅠ구매했어요조금 두께감이 있네요 50개 딱 맞게 도착했어요 잘 받았습니다 아이가 좋아해서 재구매했어요수량정확하고 유통기한도 넉넉합니다 물건 싸게 구매 잘했네요 ㅎ박스도 찌그러짐 없이 포장도 잘되서 왔구요사용기한도 넉넉하니 좋아요 다쓰고 나면 또 구매 할께요 31개월 4살 아들한테 살짝 커서 끈 양쪽 조금씩 묶어주고 쓰니 잘맞아요배송도 빠르고 질도 좋네요 한달사용기아이에게 잘맞아 좋아요 한달사용기5세남자아이편하게 잘 사용 하고 있네요 사용해 보고 재구매했어요 아이가 이것만 사용하려고 해요 7살 아이의 얼굴에 딱 맞아 좋아요 코 부분이 튀어나와 있어 숨쉬기 편하구요 6세여아에게 딱맞노조아용 깨끗한 상품이 엄청 빠르게 도착했어요 감사합니다 9살아이에게 딱 잘 맞습니다 아이에게찰떡좀두꺼워요 아이가 이것만 쓰려고해요 6살 아이 딱 맞아요
숨쉬기 편한 KF80 국산 마스크 숨프리 대형 60매,111,4.8,31800,먼지차단마스크,KF94/N95,다회용@미세먼지필터@접이식,https://shop-phinf.pstatic.net/20211026_230/1635235124490pY3J6_JPEG/36370903985820708_1490156095.jpg?type=m510,https://smartstore.naver.com/gbcommerce/products/5018608059,숨쉬기 편하고 두께도 적당히 가벼워  좋아요 재구매잘  쓰겠습니다번창하세요 가족이 모두 사용합니다만족입니다 신랑이 계속 쓰고있는 마스크 편하대요 계속쓰던 제품이고 사이즈가 넉넉해서 좋아요 잘 받았습니다이름처럼 숨쉬기 편해서 좋아요감사합니다 늘쓰던거라 주문했습니다 제품 배송이 잘못되어 긴급요청에 빠른 응대 감사하며 재구입한건데 제품은 정말 좋아요 좋아요좋아요 좋아요좋아요 한달사용기조아오ㅜ 한달사용기귀가 아프지 않아 좋아요 숨쉬기가 편하고 좋아요 숨쉬기 편하고 귀가 안 아파서 좋아요 한달사용기편하고 좋습니다다쓰면 재구매 항상이거만사용해요넘편하고좋아요 배송 빨리오고 좋습니다 매번쓰던거에요 좋습니다 한달사용기잘 쓰고 있습니다 남편이 숨쉬기 편하다고 이것만 찾아서 다시 주문했어요 재구매숨쉬기 편해요 남편이 좋아해요 숨쉬기 편하고 두께도 적당히 가벼워  좋아요 재구매잘  쓰겠습니다번창하세요 가족이 모두 사용합니다만족입니다 신랑이 계속 쓰고있는 마스크 편하대요 작년부터 쭉 착용하고 있어요 귀가 안 아프고 숨쉬기 편해서 좋습니다 늘 사용하는 마스크예요 보풀도 잘 안생겨 코가려움이 잘 없어요 배송빨라 좋아요 공간이 넉넉해서 좋아요 숨쉬기편해서 이 제품 애용합니다 배송 빠르고 좋아요재구매했습니다 재구매편안한 숨프리 마스크 재구매합니다 넉넉한 사이즈가 좋아서 재구매했어요 배송빨라요 냄새안나고 쓰기편해요 써보고 편해서 주문합니다 배송도 빠르고 갯수도 정확하고귀가 하나도 안 아파요 마스크도 크고 귀가 안 아파서 너무 편했습니다 한달사용기성인이 하기에 충분한 사이즈면서 끈도 신축성이 좋아 귀가 아프지 않은 점이 좋아요 힘이 있어서 모양도 무너지지 않고 하루 종일 잘 버팁니다 80이라 답답하지 않아요 한달사용기숨수기편하고 사이즈 넉넉해서좋았습니다 마스크가 필수품이 된 요즈음하루종일 집 밖에서는 마스크를 벗으면 안된다하지만 기존 마스크는 1시간은 고사하고 5분도 쓰고 있기 어려웠다ㅠㅠ 숨이 너무 막혀서 사무실에서도 코를 내리거나 벗기 일쑤였다 더 큰 문제는 귀가 너무 아프고 마스크가 닿는 부분은 너무 간지럽다는 사실 ㅠㅠ거리두기 25단계로 격상되면서 사무실에서 하루종일 쓰고있어야 하기에폭풍검색을 하였다숨쉬기 편한 마스크 귀가안아픈 마스크 많은 사람들이 숨프리를 추천해주셨고다른제품에 비해 조금은 비싼가격이었지만 나에게 맞기만을 바라며 주문을 하였다결과는 완전 대만족사무실에서 8시간을 쓰고 있어도 전혀 호흡에 문제가 없었고 가장 중요한 귀도 아프지 않았다같은 마스크가 이렇게 다를수가 있다니감탄을 금치못하고주변에 입소문을 내었고 직원분들도 대다수 숨프리를 구입하여 저희는 하루종일 어려움없이 마스크 착용하면서 지내고 있어요좋은 제품 감사합니다 재구매편안하고 아주 좋아요 한달사용기다른제품은 오래 착용하면 귀가 아픈데 숨트리는 전혀 아픈게 없습니다너무 잘 사용하고 있습니다 특히 안감이 보풀안나서 좋아요 한달사용기마스크중에는 이게제일편함 편안하고 좋아요 다음에 또 주문할게요 적당한가격에 배송도빠르고 좋아요 한달사용기좀 커서 화장이 덜 뭍어나니 좋네요 ㅋ요즘 가격싼제품이 많아서 다른거 샀다가 얼굴에 안맞아서 후회중 ㅠㅠ 다쓰면 다시 사러 올게요 귀도 아프지 않고 착용감이 좋습니다 배송도 빠르고 갯수도 정확하게 왔어요귀가 하나도 안 아파요 배송이 빠르고 마스크가 편해요 귀도 안아프고 너무 편해서 좋아요 재구매크고 착용감이 좋아요 숨프리 마스크는 끈 길이가 조금 길어서 귀가 덜 아파요 ㅎㅎ 그리고 마스크가 입에 안 붙어서 좋네요 써본 마스크중에 숨쉬기가 젤편해요끈도 진짜편하고 널네 배송도 빠르고 갯수도 정확하고귀도 하나도 안 아파요 배송도 빠르고 갯수도 정확하고귀가 하나도 안 아파요 마스크도 크고 귀가 안 아파서 너무 편했습니다 한달사용기성인이 하기에 충분한 사이즈면서 끈도 신축성이 좋아 귀가 아프지 않은 점이 좋아요 힘이 있어서 모양도 무너지지 않고 하루 종일 잘 버팁니다 80이라 답답하지 않아요 한달사용기숨수기편하고 사이즈 넉넉해서좋았습니다 마스크가 필수품이 된 요즈음하루종일 집 밖에서는 마스크를 벗으면 안된다하지만 기존 마스크는 1시간은 고사하고 5분도 쓰고 있기 어려웠다ㅠㅠ 숨이 너무 막혀서 사무실에서도 코를 내리거나 벗기 일쑤였다 더 큰 문제는 귀가 너무 아프고 마스크가 닿는 부분은 너무 간지럽다는 사실 ㅠㅠ거리두기 25단계로 격상되면서 사무실에서 하루종일 쓰고있어야 하기에폭풍검색을 하였다숨쉬기 편한 마스크 귀가안아픈 마스크 많은 사람들이 숨프리를 추천해주셨고다른제품에 비해 조금은 비싼가격이었지만 나에게 맞기만을 바라며 주문을 하였다결과는 완전 대만족사무실에서 8시간을 쓰고 있어도 전혀 호흡에 문제가 없었고 가장 중요한 귀도 아프지 않았다같은 마스크가 이렇게 다를수가 있다니감탄을 금치못하고주변에 입소문을 내었고 직원분들도 대다수 숨프리를 구입하여 저희는 하루종일 어려움없이 마스크 착용하면서 지내고 있어요좋은 제품 감사합니다 재구매편안하고 아주 좋아요 한달사용기다른제품은 오래 착용하면 귀가 아픈데 숨트리는 전혀 아픈게 없습니다너무 잘 사용하고 있습니다 아직 사용하지 않았어요 사용해보고 좋으면 한달후가 남길게요 감사합니다 배송은 느렸지만 정말정말 제대로 검수 잘하셔서 보내주셨습니다94가 품절이라 80으로 샀지만 만족합니다 약국서 써보거 다른 대형보다 쫌 커서 구매했어요남편과 아들은 큰거만 찾아서 빠르게 잘받았습니다요즘 코로나 재확산때문에 재구매했구요숨쉬기 좋다고해서 구매했는데그래도 아직 낮에 쓰고 나가니 덥긴해도 숨쉬기도 좋고 얼굴에 밀착도 잘되고 좋네요 숨쉬기도 편하고 하루종일 끼고 있어도 귀가 아프지 않아 좋아요 포장 잘 돼서왔어요아직 써보진 않았지만 평이 좋으니 믿음이 갑니다 숨쉬기 편하고 하루종일 끼고 있어도 귀가 아프지 않아요 재구매사용해보니 숨쉬기도 괜찮고밀착도 잘되네요제가 써보고 괜찮아서 부모님댁에 추가로 보내드렸습니다 덥지만 요즘 코로나 확산으로 구매했어요가볍고 숨쉬기도 나쁘지 않아요 숨쉬기 편하고 착용감이 좋아요 감사합니다 94도 너무 잘쓰는 왼중에 여름이라 80을 구매했어요 여름에 쓰기 넘 좋네요 커서 편하고 귀도 안당기고 좋아요눈까지 다 가려질듯요ㅋㅋ 숨쉬기 편해서 재구매합니다 숨쉬기도 말하기도 편합니다 숨프리 크기가 커서 편해서 샀어요 마스크 숨쉬기도 편하고 좋네요 숨 쉬기 좋아서 아이가 너무 좋아해요 편안해서 여러번 재구매한 상품입니다 다른것보다  크고 편합니다 안전하게 배송해주셔서 감사합니다 아직 사용하지 않았어요 사용해보고 좋으면 한달후가 남길게요 감사합니다 배송은 느렸지만 정말정말 제대로 검수 잘하셔서 보내주셨습니다94가 품절이라 80으로 샀지만 만족합니다 약국서 써보거 다른 대형보다 쫌 커서 구매했어요남편과 아들은 큰거만 찾아서 빠르게 잘받았습니다요즘 코로나 재확산때문에 재구매했구요숨쉬기 좋다고해서 구매했는데그래도 아직 낮에 쓰고 나가니 덥긴해도 숨쉬기도 좋고 얼굴에 밀착도 잘되고 좋네요 숨쉬기도 편하고 하루종일 끼고 있어도 귀가 아프지 않아 좋아요 포장 잘 돼서왔어요아직 써보진 않았지만 평이 좋으니 믿음이 갑니다 숨쉬기 편하고 하루종일 끼고 있어도 귀가 아프지 않아요 재구매사용해보니 숨쉬기도 괜찮고밀착도 잘되네요제가 써보고 괜찮아서 부모님댁에 추가로 보내드렸습니다 배송도 빠르고 좋아요 좋은상품 빠른배송 감사합니다 미리 장만했어요 만족
