Name,Review,Rating,Price,Category,Protect_factor,Mask_func,Mask_img,Purchase_link,Mask_review
굿데이이지핏 입체형 마스크 KF94 30매 개별포장 블루진 청바지 마스크,1,4.0,14900,먼지차단마스크,KF94/N95,미세먼지필터@김서림방지@저자극@방한@자외선차단@일회용,https://shop-phinf.pstatic.net/20201209_104/1607495556191KyJLx_JPEG/8631444872223445_1689489475.jpg?type=m510,https://smartstore.naver.com/ecopalmasks/products/5266295796,초5  남아쓰기 좋아요
국산 식약처허가 참존 장나라마스크 대형 KF94 화이트 새부리형 2D마스크,6,4.8,750,먼지차단마스크,KF94/N95,미세먼지필터@김서림방지@저자극@방한@자외선차단@일회용@접이식,https://shop-phinf.pstatic.net/20210305_116/1614931510236x9nQt_JPEG/16067293951588141_1806738152.jpg?type=m510,https://smartstore.naver.com/sinnaramask/products/5435603839,마스크 착용감이 타사대비 좋아요 단 가격이 조금 비싸요 사용후 또 구매하겠습니다 한달사용기얼큰이한테 크기도 넉넉하고 따갑지도 않고 좋아요 앞으로 이 마스크에 정착할 듯 합니당ㅎㅎㅎ 재구매트러블도 안나고 도톰하고 좋네요 부드러워서 마음에 드네요 빠른배송 감사합니다 정말 편하고 밀착력이좋아요
KF94 메디인 미세황사마스크 5매 포장 100매 국산원단 대형 흰색 블랙 선택,1,5.0,30000,먼지차단마스크,KF94/N95,미세먼지필터@김서림방지@저자극@일회용@접이식,https://shop-phinf.pstatic.net/20210821_144/1629529276153MilFL_JPEG/30665164660248371_1599499927.jpg?type=m510,https://smartstore.naver.com/i-master/products/5805539074,항상 이 마스크만 써요
빨아쓰는 귀안아픈 끈조절 코안아픈 숨쉬기편한 귀편한 항균 얼스메이드 식물천연염색 마스크,33,5.0,1900,먼지차단마스크,KF-AD,다회용@방한@저자극@자외선차단@미세먼지필터@접이식,https://shop-phinf.pstatic.net/20211104_153/1636011469758tUFFH_JPEG/37147368430097220_375133053.jpg?type=m510,https://smartstore.naver.com/goodzent/products/5985175718,마스크 때문에 트러블이 올라와서 바꿔봤어요통기성이 좋아 습하지 않고 숨쉬기도편하네요천연염료라 피부에도 좋고 귀코 부분도편안해요 세탁 후 여러번 쓸 수있어 경제적이고 좋습니다 쿨링감 느껴지는 착용감 덕분에 장시간 착용해도 편하고 귀부분 끈이 소프트해서 아프지 않아 맘에 들어요 세탁시 소재변형도 없어서 넘넘 맘에 듭니다 겨울이라 그런지 운동할때도 엄청 습이 차서 알아보다가 샀네요 습하지도 않고 귀도 엄청 편하고요 디자인도 유니크하니 너무나 좋습니다 숨쉬기 편하고 면도 부드러워요 포장도 꼼꼼하게 신경써서 보내주신 느낌이 많이 들었고요 배송도 빨리 왔어요 마스크는 일단 착용감이 좋아야 좋은 것 같더라고요요 제품 귀도 아프지 않고 숨쉬기도 참 편해서 오래 착용해도불편함이 없고 너무 좋네요 오오 색깔 괜찮네요 사진보다 나음 득템득템 감사히 잘쓸께요 건조기 돌려도 된다고요 요즘에 마스크끼면 귀가 아프고 오래 끼지도못하고 잘못하면 끈어지고 햇는데  요건 끈조절도 되고 귀도 안아푸네요 그리고 빨아서 쓸수잇다는게 마음에들어요 하루종일 마스크를 쓰다보니 피부에 트러블도 많이 나고 걱정되서 한번 구매해봤어요색상도 생각보다 더 이뿌고 썼을때 답답한 느낌도 덜하고 피부에 꺼슬리는 느낌이 없어서 좋네요ㅎ 호흡하기 편합니다 빨아 쓰는 제품이라 위생적으로 사용할 수 있고 피부에 닿는 면도 부드러워 피부 붉어짐이나 피부자극이 없어 사용하기에 좋아요 후기가 좋아서 사봤는데 써볼게요괜찮으면 재구매각 잘쓰겠습니다 마스크 좋네요 여러 개 사서 돌려가면서 쓰면 될듯 일체형 천으로 된거 썼는데 귀가 자꾸 끊어져서 짜증나서 사봤는데 맘에들어요 코로나 오래가서 지겹네요 마스크 값도 비싼데 여러 번 세탁해서 잘쓸께요 여러가지 색깔 있어서 고르는 맛이 있네요 천이 싼게 아닌것같아요 다른 천마스크 쓰다가 냄새나서 바꿔봤는데 굿굿 다른건 코 불편했는데 이건 안그러네요 많이파세용 사이즈가 딱 맞아서 기분이 좋습니다 엥 싸서 샀는데 이게 웬걸 마스크 맘에들어요 감사해요 비말이랑 케이에프랑 숨쉬기 불편해서 사봅니다 기대했던것보다 좋아서 깜짝 놀람 가성비 제품인듯 재구매 의사 있음 배송빨랐어요 원단 보들하니 좋네요 많이 파세요  애들것도 사줘야겠어요 맘에 들어요 괜찮은 마스크인 듯 지금까지 썻던 것 중에 제일 나아요 써보고 괜찮으면 애들것도 사려고했는데 살께요 천연염색이라 그런지 냄새도안나고 괜찮은것같아요 가성비 좋네요 가족들것도 사야겠어요 ㅎㅎㅎ 여러 개 구매하라고 싸게 파시는듯 여러 개 사서 돌려쓰면 되겠네요 귀안아프고 부드럽고 새거 특유에 냄새 없네요 맘에들어요 확실히 제대로 만든게 티가남 종이 숨쉬기 불편했는데 이건 숨 잘 쉬어짐 색깔 맘에 듭니다 원단 아주 좋아요 굿굿 솔직히 기대 이상입니다
데일리쿨마스크 여름KF80 대형 100매 습기안차는마스크 국산 의약외품덴탈마스크 낱개포장,1,3.0,19900,먼지차단마스크,KF80,미세먼지필터@저자극@김서림방지@일회용,https://shop-phinf.pstatic.net/20210409_12/1617941087550o6pxF_JPEG/19076983089479106_333985878.jpg?type=m510,https://smartstore.naver.com/yamisugar1/products/5513579669,숨쉬기가얇아서편하긴한데포장이엉망이라마스크가구겨지고끝이접혀있고맘에알들어요
윈블리 국산 3D입체형 비말차단 항균 마스크,149,4.7,4900,먼지차단마스크,KF-AD,다회용@미세먼지필터@김서림방지@저자극@방한@자외선차단@접이식,https://shop-phinf.pstatic.net/20210106_137/16099107248869Jn7V_PNG/11046559716725174_529473565.png?type=m510,https://smartstore.naver.com/tekoa2020/products/5184598920,재구매상품좋고 만족합니다 한달사용기재구매좋은제품 이네요만족합니다 한달사용기재구매마스크 부드럽고좋아요 한달사용기재구매마스크 부드럽고좋아요 재구매가성비 좋습니다 재구매했어요 재구매가성비 좋습니다 재구매했어요 재구매색깔 모야 다 좋아요세련되 보이고 한달사용기재구매너무 좋네요너무 좋네요확실 합니다 한달사용기계속재구매하고있어요가성비좋습니다 한달사용기계속재구매하고있어요가성비좋습니다 한달사용기계속재구매하고있어요가성비좋습니다 한달사용기계속재구매하고있어요가성비좋습니다 한달사용기계속재구매하고있어요가성비좋습니다 한달사용기코로나 시대에 다양한 마스크가 있는데 패션마스코로 좋은거같아요 디자인 좋고 가성비좋은듯합니다 더워지는데 그나마 얇고좋습니다 귀가안아퍼서 좋은듯합니다 빨아쓰기편하고좋아요 디자인이쁘고 괜찮아요 숨수기 편하고 핏이 예뻐요 번창 하세ᄋᆢㄷ 핏도 예쁘고 숨쉬기 편해서 만ᄌᆞㄷㄱ합니딘 보들보들좋은데 가운데 라인이 구부러져요ㅜ 분홍색 예뻐요크기는 좀 크지만 그래도 나쁘지않아요 이쁘네요 배송도 빠르고 숨쉬기 편해서 좋습니다 잘사용하겠습니다 M을 시켯더니 좀 크네요그래도 잘 쓸께요마스크는 이뻐요사은품 보내주셔서 감사합니다 사용하고 너무 편해서 다시 재구매 했습니다 디자인도 깔끔하고 신축성도 좋고 재질까지 부드럽네요하루 종일 마스크 착용해도 귀도 안 아파요정말 강추입니다 재구매좋아요 트러블 안남 재구매좋음 트러블 노노놉 재구매좋아서 재구매해썽요  빨아쓰는 마스크라 환경 오염도 안되서 좋을거 같아요 재구매 할게여 좋아요ㅔ 재구매할게요 좋아요 착용감이 좋고 보기도 좋아요 딸아이도 사용하라고 줘야겠어요 재구매좋음 트러블 ㄴㄴㄴ 생상도 사용하기도 좋아요 재구매잘 사용하고 있어요 얼굴에 잘 맞는 것 같아요 착용감도 편안함도 모두 만족해요 디자인도 착용감도 좋아요 한달사용기밖에서 운동할때 오래써도 귀가 안 아파서 좋네요 숨쉴때 코에 달라붙지 않게 안에 다른 거 하나 더 쓰고 겉에다 써도 됩니다 자꾸 얼굴에 달라 붙는다고 하네요ㅜㅜ 마스크를 어차피 쓰고 다녀야하니까 이왕이면 산뜻한게 좋겠다 싶어서 샀는데 너무 예뻐요 일회용마스크 계속쓰기도 가격이나 환경면에서 부담이었구요 색감이 산뜻하고 착용도 편해서 좋네요 재질도 좋고 일단 색상이 산뜻해서 기분좋아지는 마스크네요 일회용마스크도 계속 쓰는게 가격 부담도 있고 쓰레기문제도 있어서 이걸로 쓰고 다니려구요 건강과 패션까지 챙길 수 있는 좋은 제품같아요 이쁘고 편해요ㅎ 이쁘고 편해요ㅎ 이쁘고 편해요ㅎ 이쁘고 편해요ㅎ 재구매가격대비 만족합니다 근데 약간숨쉬기불편할때도 있어요ㅠ 입으로  숨쉴때 달라붙는점 때문에 별하나 뺐구요 착용감 굿 피부에 닿는면이 너무 부드럽고 좋네요 성인여성과 초등3 5살 아이 사이즈 골고루 구매했는데요각각의 사이즈 다 적당히 잘 맞습니다 너무  두껍지 않아서 숨쉴때  편하구요 M사이즈 완전 크고 좋네요 배송빠르고 마스크도 이뻐요 배송빠르고 마스크도 이뻐요 M사이즈 크고 좋네요 BEST재구매착용감 신축성 디자인 모두 만족합니다 지금껏 착용했던 제품중에 가장 좋아요 한달사용기아주 좋아요 잘 사용하고 있어요 가격대비 만족합니다 BEST향균마스크에 세탁도 간편하고 숨쉬기도 좋아요 패션아이템으로도 추천  환경을 생각하는 초등고학년 아이와 함께 M 사이즈 사용하니 좋아요 아이도 우유빛깔 핑크색 착용하고 기분좋게 등교했습니다  부드럽고 편해요추가 구매하려구요 잘쓰고 다녀요체크가 이쁘네요 남편 회색체크 사줬는데 편하다고 합니다 답답하지않고좋네요오 한달사용기환경 오염 최소화를 위해 추천드립니다 한달사용기환경 오염 최소화를 위해 추천드립니다 한달사용기환경 오염 최소화를 위해 추천드립니다 한달사용기BEST정말 착용감은 편하고 좋은데 천이 너무 부드러워서 숨 쉴때 코에 달라붙는게 유일한 단점입니다 한달사용기숨쉬기  너무  불편해요 숨쉴때 마다 움직여서 달라붙어요 예쁘고 잘맞아요 한달사용기숨쉴때 마다  코에 달라 붙어서 숨을 쉴수가 없습니다 너무 하네욧 마스크 촉감도 좋고손 세정재까지 챙겨주신 사장님 서비스도최고에요 BEST착용감 최고정말 진짜 완전 편합니다  이제 1회용 마스크는 안 쓰고 살겠네요얼굴 큰편인데 L사이즈 넉넉하고요 이렇게 편할 줄 몰랐는데 기대 이상입니다 딱 하나 아쉬운건 걸으면서 숨 쉴 때 코에 너무 딱 달라붙을 때가 있어요 암튼 재구매 의사주변에 선물할 의사 있습니다 한달사용기숨쉴때마다  코에 달라붙어서 숨을 쉴수가 없습니다 한달사용기편하고 부드러워 몃장 주문했어요지인들에게도 소개두하고추천합니다  BEST드디어 마음에 딱 드는 마스크를 찾았습니다마스크 없이는 못사는 요즘 같은 시기에매일 1개씩 쓰고 버리면서 불편함을 느꼈는데이제 이 마스크로 잘 관리해서 써야겠어요ㅎㅎ신축성이 좋고 디자인도 깔끔하면서 부드러운 재질까지 너무 마음에 듭니다사이즈도 딱 자연스럽게 맞아서 좋구요지인들 한테도 소개 해주고 싶어요 잘 쓰겠습니다 괜춘 괜춘 괜춘 괜춘 괜춘 예뻐요 사이즈도 잘맞아용 좋은 가격에 좋은 제품 구매 했어요실물로 받아보니 더 이쁘고 귀염깜찍해요일단 너무 편하고 재질이 좋아요부모님도 사드려야겠어요손소독제 감사해용 재구매여성분들은 M으로 하는게 맞아요얼굴 작으면 S도 가능해요 한달사용기숨쉬기 편하고 좋아서 깔별로 구매했네요 한달사용기재구매빨아쓸수있어서 좋고  숨쉬기도  편하고 좋아요 재구매착용감이 부드러워 얼굴에 알러지가 생기지 않아요 한달사용기재구매입냄새도 적고 빨아쓸수있어서  좋아요 재구매예쁘다고 주변해서 구매해달라고해서 3번째 재구매입니다 한달사용기재구매쓰기 편하고 피부트러블 없어서 좋아요 재구매안감이 부드러워서 사용하기 편하네요 재구매색상들이 깔끔하고 부드러워서 좋아요 BEST브이라인으로 보이게 해주는 입체적 체크 너무 좋아요 ㅎㅎ딸아이가 핑크 썼는데 너무 잘어울리네요집밖에 잠시 나갈때 자주 사용하게 될것같아요로고도 러블리 합니다 한달사용기재구매부드럽고  냄새 없어서  좋네요 한달사용기보드랍고좋습니다 단 숨쉴때마다 코에붙었다떨어지는게 너무적나라하게다보입니다요 한달사용기재구매보드랍고좋습니다 단 숨쉴때마다 코에붙었다떨어지는게 너무적나라하게다보입니다 한달사용기재구매보드랍고좋습니다 단 숨쉴때마다 코에붙었다떨어지는게 너무적나라하게다보입니다 한달사용기보드랍고좋습니다 단 숨쉴때마다 코에붙었다떨어지는게 너무적나라하게다보입니다 한달사용기재구매보드랍고좋습니다 단 숨쉴때마다 코에붙었다떨어지는게 너무적나라하게다보입니다 BEST오  촉감이  이렇게좋을수가있나요 일회용마스크만쓰다가  지인소개로  주문했는데  디자인도이쁘고  하루종일하고있어도  귀가 안아파요  마스크를하고있는지 모를정도임 사춘기아들은  친구거까지  주문해달라하네요  마스크를사용한지  언  1년되가네요  너무불편했는데  이제  편하게 하루를보낼수있을것같아요  감사합니다  또주문할게요 한달사용기보드랍고좋습니다 단 숨쉴때마다 코에붙었다떨어지는게 너무적나라하게다보입니다 잘쓰고있습니다  한달사용기보드랍고좋습니다 단 숨쉴때마다 코에붙었다떨어지는게 너무적나라하게다보입니다 잘 받았습니다 사이즈도 넉넉하고 편하네요 잘 받았습니다 사이즈도 넉넉하고 편하네요 잘 받았습니다 사이즈도 넉넉하고 편하네요 한달사용기재구매보들보들하니 좋네요 BEST마스크 한번쓰고 버릴때마다 돈이 너무 아까웠는데 빨아서 쓸수있다는장점도있고 신축성이 너무 좋네요 오래착용했을때도 귀뒤에가 아픈것도 타 마스크에 비하면 너무 좋습니다 하나  더 사서 부모님한테도 드려야할거같아요 ㅎㅎ 강추합니다 원단 촉감이 부드러워 착용감이 편해  귀 아프지 않아 좋아요 받자마자 너무이쁜색에 반했어요재질도 부드럽고 얇아서 부담없이 쓰기 좋아요요즘 일회용 마스크 너무 지긋한데 색다르 마스크를 산거같아서 기분이 좋네여 ㅎㅎ꼭 사세요 추천드립니다 너무 편하고 좋아용 BEST비말차단된다니 안심도 되고 항균기능에 자외선차단기능까지 귀도 안아프고 코도 정말 편하네요 피부에 닿는 촉감도 너무 좋았어요 신축성이 좋아서 편한듯 이제 일회용마스크 탈출하고 윈블리 재사용마스크로 정착합니다 한달사용기부들부들 천이좋아서 트러블도 안생기고 좋네요 BEST빠른배송 감사합니다마스크 맘에들어요 써비스로 일회용 손속제하고 스트랩 감사합니다 BEST좋아요 잘 쓰고 있어요 일회용 마스크 착용후 피부 트러블 때문에 힘들었는대 재질도 부드럽고 착용감 완전 좋아요 함께 보내주신 사은품도 감사해요 재구매천이 부드럽고 숨쉬기도 편해요 한달사용기색상도 이쁘고 숨쉬기도 편하고 좋아요 BEST조깅할때 사용해보려고 구매했어요ㅎㅎ 재질도 부드럽고 무엇보다 사이즈가 넉넉해서그런지 숨쉬기 편해서 좋아요  체크색상도 이쁘고  천도 부드러워서얼굴 트러블도 안생기고 좋네요숨쉬기도 넘 편해요 재구매숨쉬도 편하고 디자인도  좋아요 빠른배송감사합니다숨쉬기 편하고 디자인도 이쁘네요또주문할게요 제품은 좋다고 추천받아 주문했는데 역시 착용감이 너무 부드럽네요마스크스트랩에 항균케이스와 1회용 손세정제까지 듬뿍넣어 주셔서감사합니다 BEST불편하지는 안아요 좀 더 써보구 후기쓸께요 BEST다시 코로나 유행으로 이제 KF94 80매주 사는데 좀더 효율적이고 착용감이 좋은 마스크를 찾다 이제품을 사보았는데 완전 신세계이네요 착용감좋고 비밀차단에 새척기능도 있고 너무너무 좋아요 모두 합리적인 제품사용해 보세요 강추합니다 BEST편안하고 이뻐요 환경에도 도움이 되다니 무조건 쓰세요 ㅋㅋ 숨쉬기 편합니다 재구매 했어요 디자인도 색상도 이쁘네요 싸이즈도 딱맞아요 숨쉬기도 편하고 오래 착용하고 있어도 편해요 사이즈 M딱 맞아요편안하고 천이 부드러워서 좋아요 BEST우선 가볍고 얼굴에 촥 달라붙어서 얼굴라인을 예쁘게살려줍니다 숨쉬기편하구요 깔끔해요호흡도 편안해요알러지 걱정 없어요 재구매숨쉬기도 편하고 디자인도 이쁘고 해서 부모님드릴려구 재구매 했습니다받아보시고 맘에드신다고 하시네요 재구매숨쉬기도 편하고 디자인도 이쁘고 해서 부모님드릴려구 재구매 했습니다받아보시고 맘에드신다고 하시네요 재구매숨쉬기도 편하고 디자인도 이쁘고 해서 부모님드릴려구 재구매 했습니다받아보시고 맘에드신다고 하시네요 천이 부드러워서 피부트러블 없겠네요 빠른 배송 감사합니다 운동할때 사용하려구요 숨쉬기 편하고 일단 귀가 아프지 않아서 아주 좋아요 기대이상입니다 재구매할게요 BEST귀가 안아프고 숨쉬기도 편하고 굿굿 배송도 빠르고 숨쉬기도 좋아요 얇으면서 촉감이 부드러워요 BEST좋아요 가성비 최고 ㅍㅍ 선물 줄려고 재구매 했어요 BEST예쁘고  얼굴에 착 밀착되어 좋습니다 추천 100 후회없을겁니다 부드럽고 깔끔합니더 재구매제가 써보고 좋아서 친정에 선물했어요디자인 이쁘고 신축성좋아 만족하시네요 ㅋㅋ BEST재구매디자인  사이즈 다 적당합니다 좋습니다 BEST재구매재구매했네요 좋습니다 패션과 안전을 한방에 해결 적극 추천합니다 재구매추천해요운동할 땐 불편하지만 평상시에 좋아요 BEST재구매깔끔하니 좋습니다 선물했는데 좋아하네요 디자인이쁘고좋습니다 선물했는데 좋아하네요 BEST디자인이쁘고 좋습니다 BEST만족합니다매일 이거만 쓰고싶어요 재구매친정아빠도 좋아하세요 재구매굿초이스만족합니다 BEST이쁘고 숨쉬기 편해요
