Name,Review,Rating,Price,Category,Protect_factor,Mask_func,Mask_img,Purchase_link,Mask_review
"웰킵스 마스크 국산 항균 비말차단 예쁜 여름 kf94 대형,소형,초소형",40,5.0,690,먼지차단마스크,KF94/N95,미세먼지필터@일회용@접이식,https://shop-phinf.pstatic.net/20210822_142/1629607553999wg3eC_PNG/30743388569763049_454205008.png?type=m510,https://smartstore.naver.com/genie-ggook/products/5539704991,빠른 배송과 개별포장이 되어있어 아주 맘에 들어요 저렴하게 잘산것같아요 빠른배송 감사합니다 이전에 사용했던 제품인데 아이가 편하다며 구매를 요청해서 구매했어요 한달사용기BEST여름에도 덥지만 kf94놓치고 싶지 않아요잘 쓰고 있습니다 한달사용기숨쉬기 편하고 아주 좋아요 한달사용기편하게 잘 사용중입니다 빨리 도착했어요상품도 좋고 좋아요 한달사용기아기가 좋아해서 재구매했어요 애들건 웰킵스가 젤 좋은것 같아요 BEST아이가 이거만 써요 가격 좋고 배송빨라서 좋아용 잘쓸게요 배송도 빠르고 만족합니다 숨쉬기 편하고 아주 좋아요 아이가 이것만 써요 편해요 사이즈 좋구요 늘 구매하고 있어요 아이가 이것만 써요 아이한테는 약간커서 끈을 꼬아서 착용하는데 마스크는 좋아요 KF94인데 정말 저렴하게 샀어요 개별포장되어있어서 웰킵스제품 들고 다니기도 좋습니다ㅋㅋ배송 빨라서 더 좋구요ㅋㅋ또 구매할게요 가격 저렴하니 좋습니다 비말차단인줄알고 샀어요Kf94는그전에 써봤는데 좋아서 그냥 쓰려고합니다 아이가 이것만사용하려고해요 비싸도 이것만 구매합니다 웰킵스 황사방역마스크 3D입체구조라 착용감이 좋네요 초미세먼지차단에 4중구조 필터라 산뜻하게 착용해서좋아요 품질 좋고 배송 굉장히 빠릅니다_타 사이트보다 저렴해서 주문했어요 저희 아들이 웰킵스만 써요가격비교해보다 구매했는데 저렴하고 배송 빨라서 좋았습니다다쓰면 또 구매하러 올게요 배송 완전 빨라요웰킵스마스크 정말 저렴하게 잘샀습니다착용감도 좋아서 요즘 계속 웰킵스에만 손이가네요 아이가 이것만 찾아요 우리 조카들 어린이날 선물로 구매했어요귀요미에요 가성비도 좋고 아주 맘에들어요 아주 편해서 아이가 요거만 찾네요재구매각 입니다패키지도 예뻐서 선물해도 조으네요 빠른배송 만족스럽습니다 웰킵스는 제품력이 워낙 좋기때문에 믿고 사용 하고 있어요 ㅎ 웰킵스가 애들 사용하기에 정말 좋아요매일 사용하는 마스크입니다냄새없어서 좋고 배송 빠르네요 아이 어린이집 선물로 주려고 샀어요 저렴하게 잘샀습니다 웰킵스소형 가격 저렴해서 좋네요♡ 요즘 마스크 필수 잖아요 아이들이 불하지 않아 너무 좋다고 하더라구요  외출할때 필수템웰킵스가 저는 제일 좋더라구요배송 총알 이고 여기 제일 싼듯 어른용도 어린이용도 넘 편한것 같아요사용감 대만족 별다섯개 아이들 마스크 어떤거 살까 고민 많이하다 선택 한 만큼 만족합니다 아이들 쓰기에 좋은 마스크 정말 좋아용 꼼꼼한 포장과 빠른배송에 만족합니다 미세먼지나 황사때문에 걱정이였는데웰킵스마스크는 4중구조 고효율필터라 안심되네요 마스크 내부공간도 넓고 장시간 착용해도 쾌적해 엄지척이네요 월킵스마스크가 좋다는소문에 구입해보았어요대형사이즈 고2아이들과 함께 착용중이예요3단 접이식에 4중구조 고효율필터라 방어력이 우수해좋네요 사이즈도 디자인도 맘에들어요 편하고 가성비좋고 또 구매하려고 접속했어용 요즘 요것만 사서 쓰는거같아요착용감이 편해서 추처두 마구마구 정말 맘에들어요 굳굳
KF94 아토 마스크 새부리형 컬러 블랙 그레이 대형 중형 소형 귀안아픈 국산 비말차단,40,4.9,24500,먼지차단마스크,KF94/N95,미세먼지필터@김서림방지@저자극@방한@일회용@접이식,https://shop-phinf.pstatic.net/20211019_263/16346096328192frpe_PNG/35745412530876151_1775400672.png?type=m510,https://smartstore.naver.com/allmaman/products/5941045560,너무하네여 방송중에 구매하고 톡톡으로 공유인증하면 랜덤마스크도 추가로 보내주는거 아니었나요 그리고 쿠폰 사용도 안된다고 톡톡으로 말씀드렸고 쿠폰 사용 안되서 마스크 한장이라도 더 넣어 보내주려나 기대했는데 오히려 톡톡 인증한 것도 안보내줌 뭐야 어이없네여기까지 전에 썼던 리뷰에요 사실 마스크 품질도 좋고 사이즈 비교샷이니 이것저것 좋은 리뷰를 달려고 이만저만 사진도 찍어놓고 했었는데 뭔가 갑자기 울컥 하면서 서운함이 확 몰려오더라구요 산후우울증인가;; 육아 스트레스도 많고 집에만 있다보니 감정이 좀 컨트롤이 안됐었나봅니다 그래도 꾹꾹 참으며 정중하게 답글 달아주셔서 감사하고 죄송해서 수정하러 왔어요 마스크는 여자는 미듐하시는게 맞을거 같구요 본인은 얼굴이 크지 않다며 라지 크다고 우기던 신랑은 라지가 딱 맞네요 얼굴을 가리는 부분은 라지썼을때 신랑도 살짝 큰감이 있는데그만큼 얼굴을 완전 커버해줘서 좀 편하고 보기좋아요 귀 끈이 조금 짱짱 한 느낌이고 길이가 길지 않아서 미듐 사용하면 귀가 아프다고 하네요제가 젤 맘에 들었던 부분은 냄새가 안나는 거였어요 여태 브랜드 있는것도 써봤고 중국산도 써봤고마스크대란때여기저기서 얻어써보기도 했는데 다들 펄프냄새가 좀 심한것도 있고 싫더라구요 평소 코가 상당히 예민한 편입니다 근데 이것도 뭐 기대도 안하고 열었는데 왠걸 냄새가 없네요 하나 써봐서 정말 정말 확실한건 아닌데 딱 열고 꺼냈을때 나는 그 펄프냄새가 없어서 응 냄새안나네 라고 생각했던거 같아요 그리고 새 부리형도 좀 작은 사이즈는 말하거나 숨쉬기 좀 불편한데 이건 좀 여유있게 나와서 그런지 말할때나 숨쉴때 좀 편안해요피부도 좀 예민한 편이라 아무거나 쓰면 광대쪽에 트러블 나고 하는데 그런것도 딱히 없고 떨어뜨렸을때 반으로 촵 접히니 뭐 오염도 덜되고 가격도 싸고 뭐 흠잡을데가 없네요무튼 정말 기대안하고 신랑이 마스크 사야한다고 해서 네이버 쇼핑 들갔는데 마침 하고있길래 이차저차 해서 산건데 훌륭합니다 쓸데없는 말같지도 않은 소리에 답글 다 달아주시고 죄송합니다당신의 인내심에 박수를 보내며짝짝짝진상부렸던 고갱은 물러갑니다 번창하세여  0;;; 약속도 안지키는 나쁜사람들 공유인증하면 랜덤 마스크 준다더니 안보내줌 어이상실 다른 후기 보니까 받았음 나만안줌 실망실망 대실망 랜덤마스크 기다립니다 안주기만 해봐여기까지 전에 썼던 리뷰에요 사실 마스크 품질도 좋고 사이즈 비교샷이니 이것저것 좋은 리뷰를 달려고 이만저만 사진도 찍어놓고 했었는데 뭔가 갑자기 울컥 하면서 서운함이 확 몰려오더라구요 산후우울증인가;; 육아 스트레스도 많고 집에만 있다보니 감정이 좀 컨트롤이 안됐었나봅니다 그래도 꾹꾹 참으며 정중하게 답글 달아주셔서 감사하고 죄송해서 수정하러 왔어요 마스크는 여자는 미듐하시는게 맞을거 같구요 본인은 얼굴이 크지 않다며 라지 크다고 우기던 신랑은 라지가 딱 맞네요 얼굴을 가리는 부분은 라지썼을때 신랑도 살짝 큰감이 있는데그만큼 얼굴을 완전 커버해줘서 좀 편하고 보기좋아요 귀 끈이 조금 짱짱 한 느낌이고 길이가 길지 않아서 미듐 사용하면 귀가 아프다고 하네요제가 젤 맘에 들었던 부분은 냄새가 안나는 거였어요 여태 브랜드 있는것도 써봤고 중국산도 써봤고마스크대란때여기저기서 얻어써보기도 했는데 다들 펄프냄새가 좀 심한것도 있고 싫더라구요 평소 코가 상당히 예민한 편입니다 근데 이것도 뭐 기대도 안하고 열었는데 왠걸 냄새가 없네요 하나 써봐서 정말 정말 확실한건 아닌데 딱 열고 꺼냈을때 나는 그 펄프냄새가 없어서 응 냄새안나네 라고 생각했던거 같아요 그리고 새 부리형도 좀 작은 사이즈는 말하거나 숨쉬기 좀 불편한데 이건 좀 여유있게 나와서 그런지 말할때나 숨쉴때 좀 편안해요피부도 좀 예민한 편이라 아무거나 쓰면 광대쪽에 트러블 나고 하는데 그런것도 딱히 없고 떨어뜨렸을때 반으로 촵 접히니 뭐 오염도 덜되고 가격도 싸고 뭐 흠잡을데가 없네요무튼 정말 기대안하고 신랑이 마스크 사야한다고 해서 네이버 쇼핑 들갔는데 마침 하고있길래 이차저차 해서 산건데 훌륭합니다 쓸데없는 말같지도 않은 소리에 답글 다 달아주시고 죄송합니다당신의 인내심에 박수를 보내며짝짝짝진상부렸던 고갱은 물러갑니다 번창하세여  0;;; 라방보고 챗으로 아이사이즈 여쭤보고 추천해주신걸로 샀는데 완전 찰떡입니다여름까지 아임리얼 잘썼는데 아이좀 작은것같다해서 새로샀어요155에 44  남아예요화이트 그레이 1박스씩 구매했어요그레이 이쁘네요 늘 믿고사는 대한청년상회얼큰이 신랑 얼큰이 아들램 덕분에 사이즈비교 해가면서 사도 실패한적도 많아서 아x르m사이즈만 주구장창 고집하던 녀석이였는데 대한청년상회에서 첨 에블린 구매해서 여름동안 잘사용했고 아토방송때 썬파파님이 아x르L 사이즈랑 아토L사이즈 비교해주셔서 아토L구매했는데 신랑이 잘샀다고 칭찬해줘서 이번에 아이들꺼 SM사이즈 주문했는데 얼큰이 녀석한테도 사이즈딱 하루에 마스크를 기본적으로 3개이상 쓰는 큰녀석에겐 가격도 딱  사이즈도 딱 혹시나 하는마음에100장 씩 주문했는데 더쟁였어야되는건데 살포시후회가 다음라방때는 더 쟁여놔야겠어요 늘 행운이따르는 대한청년상회 내돈내산인데 선물받는기분 진짜 아 이랑 사이즈 똑같구요마스크 길이만 살짝 짱짱한거같네요너무 좋구요 편하네요자꾸 이것저것 샀었는데 가격과 품질  모두 합리적인 제품이어서 정착해도 될것같습니다 진짜 아 이랑 사이즈 똑같구요마스크 길이만 살짝 짱짱한거같네요너무 좋구요 편하네요자꾸 이것저것 샀었는데 가격과 품질  모두 합리적인 제품이어서 정착해도 될것같습니다 성인남성이 착용시 얼굴 전체를 감싸줄만큼 사이즈가 크고 좋아요 부드럽고 숨쉬기 편하고 아쉬운점은 약간 밑으로 내려오는; 개인마다 차이가 있겠지만 가격대비 만족합니다 가격대비 괜찮아요 중형인데 남편도 맞아요귀도 안아프고 좋아요 재구매한거예요신랑이 너무 편하고 좋다합니다ㅎㅎ 성인남성 중형사이즈 잘 맞네요 추천해주셔서 알맞게 잘 산듯 싶어요 대형살까 중형살까 고민했는데 여자 보통얼굴 중형 잘 맞아요 믿고사는 대한청년상회얼큰이 신랑 때문에 아토L 사보고 신랑한테 칭찬듣고이번엔 아이들꺼 SM 구매했는데 사이즈가 s은 초등 1학년이 쓰기엔 조금 낙낙하긴한데 끈 한번 꼬아서 사용하니 편하다고 잘사용해요 남자성인한테도 잘 맞네요 좋아요 한달사용기빠른 배송 감사합니다 괜찮은거 같아요 가격대비 편하고 좋네요 저희 신랑이 얼굴이 조금 큰편인데 이 마스크는 사이즈가 딱이네요 오늘 쓰고 출근했는데  부디 편했다고 얘기했으면 합니다 라방정말좋아요배송도 빠르고 좋아요아토는 처음 써보는데 써보는대로 후기 남길께요 기대이상 완전 맘에 들어합니다국대 대형쓰는 아들 중형m 잘맞아요 아토 마스크 정말좋아요사이즈도 잘맞고 이벤트 자주했음 좋겠어요 여자인제가쓰기는좀커요얼굴전체거의 다감싸요 저번에 사서 잘써서  재주문한거예요전 아토에 정착했답니다 국대쓰던 아들아토 m 사이즈 완전 좋아요 동생이 만족하고 사용하고 있어요 중형사이즈 여성분들쓰시기좋아요 재구매해서 샀는데 귀아안아픈것을 찾는 남푠이 만족해서  대형을 구매했는데 저한테는 크더라구요   제가 얼굴이 작은편은 아닌데  ㅋㅋ   그래서 이번에 재구매하면서  중형으로 구매했는데 아주 맞춤이네요  완전만족입니다   3차 재구매 의사 있어요 배송도 빠르고 제품 재질도 좋고 가격대비 좋아요 배송도 빠르고 제품 재질도 좋고 가격대비 좋아요 아토 마스크 말할 필요가 없어요넘 만족해요 빠른배송 감사합니당 커요 에어데이즈 대형이랑 비슷할줄알았는데 확실히 에어데이즈가 커도 얼굴에 잘 맞는느낌이 나고 이건 커요ㅠㅠㅠ 검정색이 필요해서 산거라 잘 쓰긴 하겠지만 배송 최고라방보다 구매했는데 다음날 바로옴 크기도좋고 특가로잘샀어요 크기도좋고 특가로잘샀어요♡ 너무좋습니다 너무좋습니다 빠른 배송 감사합니다 빠른 배송에 믿을 수 있는 품질 빠른 배송에 믿을 수 있는 품질 너무너무너무 좋아요 너무너무너무 좋아요
KF80대형흰색 웰크론 어디가 마스크 써야지 케어온황사 방역용 마스크 대형 15매,6,4.5,9900,먼지차단마스크,KF80,미세먼지필터@김서림방지@저자극@일회용@접이식,https://shop-phinf.pstatic.net/20200913_123/15999292716115Dge1_PNG/37290814233719942_133027985.png?type=m510,https://smartstore.naver.com/aniauns/products/5112759875,숨쉬기도 편하고 보들 거려서 좋아요 조 카가 이것만 쓸려합니다 숨쉬기 편하대요 디자인숨쉬기  참 좋아요KF94사용하고있고  80대형은 어떤가 궁금해서 구매했구근데 대형치고 사이즈가 큰편이 아니라서 아쉬워요아스탠다드핏 대형이 잘 맞으시는분은   이 상품이 작으니 참고하세요우리 고딩애 이제 여름학교생활에  숨쉬기좋을듯해서  아들애용으로 구입해야겠어요  답답하지안고 숨쉬기좋다하네요  이번 여름 또  학ㅈ교에서 개고생하게생겼는데  이 마스크가 도움이 많이 될듯해요    근데  이  사이즈는  아무래도  아들애한테 딱 맞는것이  중형사이즈라볼수있어요  대형을 좀더 크게 만들어주시면 좋겠습니다    어중간한대형사이즈들이 너무 많아  계속 사이즈 낭패를 보고있어서  아대형 새부리만사용하게되네요 한달사용기고2아들애가 숨쉬기좋다해요다른 마스크에비해   코쪽으로 숨쉬기 좋게 해놔서 운동할때 좋다하네요좀 더 큰것도 만들어주시면 좋겠어요 사용하고싶어도 사이즈가 작아요고2아들애가 작은얼굴인데 딱 맞거든요ㅜ 빠르고 좋아요 배송비 없어 좋아요 한달사용기최고입니다
KF94 새부리형 먼지어흥 방역 2D 마스크 소형 화이트 식약처 허가 20매,1,5.0,10400,유아마스크,KF94/N95,미세먼지필터@김서림방지@저자극@자외선차단@방수@일회용@접이식@키즈,https://shop-phinf.pstatic.net/20210906_186/1630863201726lzevP_JPEG/31999090432429760_385260887.jpg?type=m510,https://smartstore.naver.com/mask2u/products/5842437751,마스크 살때마다 사이즈안맞아서 실패 했는데 어웅이 마스크는 사이즈 너무 잘맞아여 아이도 너무 좋아해여
엠플러스 국산 황사마스크 KF80 (10매),70,4.8,5500,먼지차단마스크,KF80,일회용,https://shop-phinf.pstatic.net/20210507_68/16203731961349TLkI_JPEG/21509029946298300_188137869.jpg?type=m510,https://smartstore.naver.com/s-h/products/4904870391,여름부터 쭉 이것만 써요 마스크가 얼굴에 착 붙어요 들뜸없고 구김없이 마치 제 얼굴 맞충인듯 재주문할 생각 한달사용기마스크 끈이 넓은끈에서얇은끈으로바뀐게아쉽지만잘쓰고있어요 항상쓰던거에요 딱좋아요 빠른 배송 감사 합니다 여러제품 사용해봤는데 이제품이 저에게 정말 잘맞는것 같아요설명처럼 귀걸이도 유현해서 좋았고입도 닿지 않아서 좋았습니다추후 재구매할게요 배송도 빠르고   좋아요 한달사용기크기도 적당하고 끈도 짱짱해요사용해본 마스크중 제일 편했어요 재구매kf80이 여름엔 제격입니다꾸준히 여기서 구매하고 있어요냄새도 덜나고 좋아요 한달사용기소재가 좋아 보입니다잘 착용하고 다닙니다 한달사용기이시국에  알맞게  잘쓰고  있어요 한달사용기80이고 국산이며 인증된 마스크라 아주 좋습니다 가격도 좋아요 한달사용기냄새안나고 개별포장되어있고 kf80국산이라 좋아요 약국에서 사서 써보고 너무 좋아서 인터넷으로 찾아봐서 샀습니다숨쉬기 너무편합니다 요즘 94는 쓰기 너무 덥고 얇은마스크는 의약외품이 아니라서 안좋다하고심지어  공산품중국산을 홈쇼핑에서도 판매하고도대체 어떤걸 사야하나 했는데 드디어 찾았어요ㅋ80이라 확실히 덜 답답합니다 한달사용기좋아요 만족합니다 좋아요 더운 날씨에도 착용해도 되겠어요비말 마스크가 불안해 주문했는데 만족하네요 아직 사용전이라 사용해 보고 다시 후기 올릴게요 배송빠르고 가격은 착합니다 80이라 94 보다 얇고 쓸만해요 감사합니다 저렴하게 잘 산것같어요 빠른 배송이 너무 좋네요 가격도 만족스럽고요 굳이 kf94까지 필요없어서 kf80시켰는데 좋아요 배송이 좀 느리지만 제품은 좋아요 고딩 아들이  편하다고  잘쓰고  다녀요포장도  깔끔합니다 저렴한사격에 샀네요ㅎㅎ 한달사용기얇고 숨쉬기편해요 좋아요 만족합니다 좋아요 빠른배송과 좋은품질 믿고쓰는 더워지면서  94힘들었는데한80으로 여름 지낼듯하네요 배송도 빠르고 좋아요 품질좋고 숨쉬기수월해짐 진짜 총알배송이구용 대한민국 제품이라 좋아요 약국에서 사보고 편해서 인터넷으로 더 삿어요 배송 금방 받았습니다 다른곳보단 저렴하게 잘 산거 같아요마스크 가격이 점점 내려가길 기도합니다 배송빨랐고 잘 받았습니다 80이지만 딱 맞아서 효과는 좋을 거 같습니다 잘 쓸게요 생각보다 마스크가 사이즈가 많이크네요 잘받았어요 좋아요 많이파세요 다음에또구매할게요 재구매수량정확하고 배송 총알배송이네요하루만에왓어요 숨쉬기도편하고좋아요 더워져서 kf80으로 구매했어요 막 저렴하진않지만 구매할수있어서 다행입니다 아주 좋습니다 국산이라 믿음 가구요 포장 상태도 좋고 인증제품이라 안전합니다 좋은 제품을 잘 사용하고 있습니다 kf94 사용하기에는 날씨가 더워서 kf80있어서 구매했어요 잘 사용할께요 배송빠르고제품도좋아요 보푸라기만 안나면 좋겠어요 재구매저번에 사고 만족해서 또샀어요 더운날씨에 kf94는 답답했는데 kf80마스크는 편하네요 재구매숨쉬기 편하고 얼굴 빈틈없이 잘가려져서 너무좋아요냄새안나고 가볍네요 빠른배송 감사드림니다 갯수가 맞게 왔고 숨쉬기가 94보다 나을거라 기대됩니다 요즘같은 시기에 저렴하게 살수있어서 좋아용 아주잘도착했어요 이제더워지니80을찾게되네요  잘받았습니다 유용하게 잘쓸께요 좋아요 배송도빨라요더워져서 80이좋아오ㅡ 좋아요 배송도빨랐어요 화면이랑 똑같아요 배송도 빠르고 잘 받았습니다 빠른배송 좋아요 재구매할께요 빠른 배송에 편하고 좋아요 잘받았습니다아이얼굴에 잘 맞아요 브랜드별로 호불호가 갈리는데 이거 괜찮은 제품인 거 같네요 잘 쓰겠습니다 쿠폰 쓰고 무배라 조금 싸게 산거 같아 좋아요 큰대형 찾고있었는데 좋아요 빠른배송 감사합니다 날이  더유서 구매했어요 잘 받았습니다 최근 날짜라 좋아요 여름에 94쓰기는 답답할것같아서 샀는데 좋아요 잘받았습니다가격이 살짝 올랐네요 배송도 빠르고 좋아요 괜찮아요괜찮아요괜찮아요
[2021년 제조] 국산KF94 마스크 - 마스크케이,26,4.5,11950,먼지차단마스크,KF94/N95,미세먼지필터@일회용@접이식,https://shop-phinf.pstatic.net/20211021_210/1634800248356uovgE_JPEG/35936027908585664_2109352991.jpg?type=m510,https://smartstore.naver.com/gpcase/products/5868203496,무료체험BEST마침 시간이 생겨 리뷰작성을 합니다  개선점은 보내실때 테이프로 한번만 마스크 박스 입구에 붙어주셨으면 좋겠습니다 두박스중 한박스는 더이상 마스크를 넣고 있긴 불편했는지 마스크를 택배상자에 뱉고 있었습니다 일일이 세보기는 귀찮고 그냥 구겨 넣고 사진 찍었습니다 마스크는 제 기준 타 사 대형 마스크보다 작은 느낌입니다만 뭔가  얼굴에 착 감기는 느낌입니다불편하지 않습니다 불편한냄새도 딱히 없는 것 같습니다 마스크가 필요한 지인에게 줄때 마스크 껍질 촉감도 좋고 미국 FDA에 가보진 못했지만 등록 되어 있어 자부심이 생깁니다 감사합니다 무료체험크고 숨쉬기도 좋아요 재구매좋아요 잘 쓰겠습니다 무료체험재구매가격이 마니 올라서 다른걸알야봐야 하나싶네요 무료체험BEST선물로 샀는데 레모나표시있어서 이쁜거 같애요 무료체험잘받았어요가격이 좀더 저렴하면 좋을듯요 무료체험저렴한 가격에 잘샀어요 무료체험저렴하게 가성비최고입니다 무료체험세이브원이랑 마스크케이 동시에 샀는데 마스크케이가 살짝 쬐끔 더 작음 세이브원이 쬐끔 크다 싶은 분들은 오히려 더 좋음 무료체험몇번째 재구매 가성비 좋고커서 편안합니다 무료체험배송이 하루만에 와서 개꿀이네요 마스크는 가성비 최고인듯 한달사용기무료체험잘쓰고 있어요 좋아요 무료체험비움은 가성비와 착용감 모두 굿이예요 잘쓰고있습니다 재고 채워주세요 무료체험종류별로해서 300장 주문했는데 다 좋아요 무료체험사이즈 맞고 개별포장이라 좋아요 무료체험한번 사용해보겠습니다 무료체험배송이 조금 늦고 비움마스크는 여성용입니다 주문시 착오 없으시길 무료체험제품 좋아요사이즈도 맞아요 무료체험마스크 크기가 커서 좋습니다 촣아요 좋아요 좋아요 무료체험좋아요좋아요 무료체험삼실에서 쓸려고 주문했어요 사이즈가 좋네요 무료체험배송도빠르고 상품도 좋아요 무료체험저렴한가격 고품질이네요 무료체험좋아요 잘받았습니다
